"ID","Description","Data_type","Method","N","Ncase","Gender_specific","URL"
"20550_1","Activities undertaken to treat anxiety: Talking therapies, such as psychotherapy, counselling, group therapy or CBT","Binary","LR",17652,2438,"","https://ukb-wes.oss-us-west-1.aliyuncs.com/20550_1.v1.1.fastGWA.gz"
"20425","Ever worried more than most people would in similar situation","Binary","LR",17652,4724,"","https://ukb-wes.oss-us-west-1.aliyuncs.com/20425.v1.1.fastGWA.gz"
"20549_4","Substances taken for anxiety: Drugs or alcohol (more than once)","Binary","LR",17652,1076,"","https://ukb-wes.oss-us-west-1.aliyuncs.com/20549_4.v1.1.fastGWA.gz"
"20550_3","Activities undertaken to treat anxiety: Other therapeutic activities such as mindfulness, yoga or art classes","Binary","LR",17652,1060,"","https://ukb-wes.oss-us-west-1.aliyuncs.com/20550_3.v1.1.fastGWA.gz"
"20549_3","Substances taken for anxiety: Medication prescribed to you (for at least two weeks)","Binary","LR",17652,2381,"","https://ukb-wes.oss-us-west-1.aliyuncs.com/20549_3.v1.1.fastGWA.gz"
"20549_1","Substances taken for anxiety: Unprescribed medication (more than once)","Binary","MLM",17652,519,"","https://ukb-wes.oss-us-west-1.aliyuncs.com/20549_1.v1.1.fastGWA.gz"
"2624","Frequency of heavy DIY in last 4 weeks","Ordered_Categorical","LR",18811,NA,"","https://ukb-wes.oss-us-west-1.aliyuncs.com/2624.v1.1.fastGWA.gz"
"2634","Duration of heavy DIY","Ordered_Categorical","LR",18845,NA,"","https://ukb-wes.oss-us-west-1.aliyuncs.com/2634.v1.1.fastGWA.gz"
"20403","Amount of alcohol drunk on a typical drinking day","Ordered_Categorical","LR",19287,NA,"","https://ukb-wes.oss-us-west-1.aliyuncs.com/20403.v1.1.fastGWA.gz"
"20416","Frequency of consuming six or more units of alcohol","Ordered_Categorical","MLM",19320,NA,"","https://ukb-wes.oss-us-west-1.aliyuncs.com/20416.v1.1.fastGWA.gz"
"20421","Ever felt worried, tense, or anxious for most of a month or longer","Binary","LR",19548,5329,"","https://ukb-wes.oss-us-west-1.aliyuncs.com/20421.v1.1.fastGWA.gz"
"2385","Relative age voice broke","Ordered_Categorical","LR",19639,NA,"YES","https://ukb-wes.oss-us-west-1.aliyuncs.com/2385.v1.1.fastGWA.gz"
"2744","Birth weight of first child","Ordered_Categorical","MLM",19678,NA,"YES","https://ukb-wes.oss-us-west-1.aliyuncs.com/2744.v1.1.fastGWA.gz"
"20502","Ever had period extreme irritability","Binary","LR",20296,5420,"","https://ukb-wes.oss-us-west-1.aliyuncs.com/20502.v1.1.fastGWA.gz"
"20548_2","Manifestations of mania or irritability: I was more restless than usual","Binary","LR",20296,2350,"","https://ukb-wes.oss-us-west-1.aliyuncs.com/20548_2.v1.1.fastGWA.gz"
"20548_7","Manifestations of mania or irritability: I was easily distracted","Binary","LR",20296,1705,"","https://ukb-wes.oss-us-west-1.aliyuncs.com/20548_7.v1.1.fastGWA.gz"
"20548_3","Manifestations of mania or irritability: My thoughts were racing","Binary","LR",20296,1992,"","https://ukb-wes.oss-us-west-1.aliyuncs.com/20548_3.v1.1.fastGWA.gz"
"20548_5","Manifestations of mania or irritability: I needed less sleep than usual","Binary","MLM",20296,701,"","https://ukb-wes.oss-us-west-1.aliyuncs.com/20548_5.v1.1.fastGWA.gz"
"20548_8","Manifestations of mania or irritability: I was more confident than usual","Binary","LR",20296,659,"","https://ukb-wes.oss-us-west-1.aliyuncs.com/20548_8.v1.1.fastGWA.gz"
"20548_6","Manifestations of mania or irritability: I was more creative or had more ideas than usual","Binary","LR",20296,587,"","https://ukb-wes.oss-us-west-1.aliyuncs.com/20548_6.v1.1.fastGWA.gz"
"20548_1","Manifestations of mania or irritability: I was more talkative than usual","Binary","MLM",20296,1032,"","https://ukb-wes.oss-us-west-1.aliyuncs.com/20548_1.v1.1.fastGWA.gz"
"20548_9","Manifestations of mania or irritability: I was more active than usual","Binary","MLM",20296,1071,"","https://ukb-wes.oss-us-west-1.aliyuncs.com/20548_9.v1.1.fastGWA.gz"
"2794","Age started oral contraceptive pill","Continuous","MLM",20383,NA,"YES","https://ukb-wes.oss-us-west-1.aliyuncs.com/2794.v1.1.fastGWA.gz"
"20522","Been in a confiding relationship as an adult","Ordered_Categorical","LR",20418,NA,"","https://ukb-wes.oss-us-west-1.aliyuncs.com/20522.v1.1.fastGWA.gz"
"20501","Ever had period of mania / excitability","Binary","MLM",20429,945,"","https://ukb-wes.oss-us-west-1.aliyuncs.com/20501.v1.1.fastGWA.gz"
"2375","Relative age of first facial hair","Ordered_Categorical","LR",20457,NA,"YES","https://ukb-wes.oss-us-west-1.aliyuncs.com/2375.v1.1.fastGWA.gz"
"20460","Belief that own life is meaningful","Ordered_Categorical","LR",20481,NA,"","https://ukb-wes.oss-us-west-1.aliyuncs.com/20460.v1.1.fastGWA.gz"
"20525","Able to pay rent/mortgage as an adult","Ordered_Categorical","LR",20602,NA,"","https://ukb-wes.oss-us-west-1.aliyuncs.com/20525.v1.1.fastGWA.gz"
"20500","Ever suffered mental distress preventing usual activities","Binary","LR",20628,7158,"","https://ukb-wes.oss-us-west-1.aliyuncs.com/20500.v1.1.fastGWA.gz"
"20531","Victim of sexual assault","Binary","LR",20650,3233,"","https://ukb-wes.oss-us-west-1.aliyuncs.com/20531.v1.1.fastGWA.gz"
"20490","Sexually molested as a child","Ordered_Categorical","MLM",20675,NA,"","https://ukb-wes.oss-us-west-1.aliyuncs.com/20490.v1.1.fastGWA.gz"
"20471","Ever seen an un-real vision","Binary","LR",20677,712,"","https://ukb-wes.oss-us-west-1.aliyuncs.com/20471.v1.1.fastGWA.gz"
"20552_2","Behavioural and miscellaneous addictions: A behaviour","Binary","MLM",20678,236,"","https://ukb-wes.oss-us-west-1.aliyuncs.com/20552_2.v1.1.fastGWA.gz"
"20401","Ever addicted to any substance or behaviour","Binary","LR",20678,1323,"","https://ukb-wes.oss-us-west-1.aliyuncs.com/20401.v1.1.fastGWA.gz"
"20513","Recent thoughts of suicide or self-harm","Ordered_Categorical","LR",20753,NA,"","https://ukb-wes.oss-us-west-1.aliyuncs.com/20513.v1.1.fastGWA.gz"
"20491","Someone to take to doctor when needed as a child","Ordered_Categorical","LR",20766,NA,"","https://ukb-wes.oss-us-west-1.aliyuncs.com/20491.v1.1.fastGWA.gz"
"20479","Ever thought that life not worth living","Ordered_Categorical","LR",20781,NA,"","https://ukb-wes.oss-us-west-1.aliyuncs.com/20479.v1.1.fastGWA.gz"
"20463","Ever heard an un-real voice","Binary","MLM",20804,380,"","https://ukb-wes.oss-us-west-1.aliyuncs.com/20463.v1.1.fastGWA.gz"
"20512","Recent feelings of foreboding","Ordered_Categorical","LR",20807,NA,"","https://ukb-wes.oss-us-west-1.aliyuncs.com/20512.v1.1.fastGWA.gz"
"20458","General happiness","Ordered_Categorical","MLM",20808,NA,"","https://ukb-wes.oss-us-west-1.aliyuncs.com/20458.v1.1.fastGWA.gz"
"20505","Recent easy annoyance or irritability","Ordered_Categorical","LR",20816,NA,"","https://ukb-wes.oss-us-west-1.aliyuncs.com/20505.v1.1.fastGWA.gz"
"20506","Recent feelings or nervousness or anxiety","Ordered_Categorical","LR",20818,NA,"","https://ukb-wes.oss-us-west-1.aliyuncs.com/20506.v1.1.fastGWA.gz"
"20509","Recent inability to stop or control worrying","Ordered_Categorical","LR",20818,NA,"","https://ukb-wes.oss-us-west-1.aliyuncs.com/20509.v1.1.fastGWA.gz"
"20507","Recent feelings of inadequacy","Ordered_Categorical","LR",20818,NA,"","https://ukb-wes.oss-us-west-1.aliyuncs.com/20507.v1.1.fastGWA.gz"
"20520","Recent worrying too much about different things","Ordered_Categorical","LR",20825,NA,"","https://ukb-wes.oss-us-west-1.aliyuncs.com/20520.v1.1.fastGWA.gz"
"20528","Diagnosed with life-threatening illness","Binary","LR",20835,3242,"","https://ukb-wes.oss-us-west-1.aliyuncs.com/20528.v1.1.fastGWA.gz"
"20485","Ever contemplated self-harm","Ordered_Categorical","LR",20836,NA,"","https://ukb-wes.oss-us-west-1.aliyuncs.com/20485.v1.1.fastGWA.gz"
"20499","Ever sought or received professional help for mental distress","Binary","LR",20839,8448,"","https://ukb-wes.oss-us-west-1.aliyuncs.com/20499.v1.1.fastGWA.gz"
"20510","Recent feelings of depression","Ordered_Categorical","LR",20839,NA,"","https://ukb-wes.oss-us-west-1.aliyuncs.com/20510.v1.1.fastGWA.gz"
"20489","Felt loved as a child","Ordered_Categorical","LR",20842,NA,"","https://ukb-wes.oss-us-west-1.aliyuncs.com/20489.v1.1.fastGWA.gz"
"20441","Ever had prolonged loss of interest in normal activities","Binary","LR",20846,8544,"","https://ukb-wes.oss-us-west-1.aliyuncs.com/20441.v1.1.fastGWA.gz"
"20515","Recent trouble relaxing","Ordered_Categorical","LR",20846,NA,"","https://ukb-wes.oss-us-west-1.aliyuncs.com/20515.v1.1.fastGWA.gz"
"20524","Sexual interference by partner or ex-partner without consent as an adult","Ordered_Categorical","LR",20848,NA,"","https://ukb-wes.oss-us-west-1.aliyuncs.com/20524.v1.1.fastGWA.gz"
"20523","Physical violence by partner or ex-partner as an adult","Ordered_Categorical","LR",20848,NA,"","https://ukb-wes.oss-us-west-1.aliyuncs.com/20523.v1.1.fastGWA.gz"
"20554_5","Actions taken following self-harm: See own GP","Binary","LR",20849,249,"","https://ukb-wes.oss-us-west-1.aliyuncs.com/20554_5.v1.1.fastGWA.gz"
"20554_6","Actions taken following self-harm: Receive help from friends / family / neighbours","Binary","LR",20849,302,"","https://ukb-wes.oss-us-west-1.aliyuncs.com/20554_6.v1.1.fastGWA.gz"
"20553_4","Methods of self-harm used: Ingesting a medication in excess of the normal dose","Binary","LR",20849,595,"","https://ukb-wes.oss-us-west-1.aliyuncs.com/20553_4.v1.1.fastGWA.gz"
"20554_1","Actions taken following self-harm: See anyone from psychiatric or mental health services, including liaison services","Binary","LR",20849,367,"","https://ukb-wes.oss-us-west-1.aliyuncs.com/20554_1.v1.1.fastGWA.gz"
"20554_3","Actions taken following self-harm: Need hospital treatment (eg A&E)","Binary","LR",20849,448,"","https://ukb-wes.oss-us-west-1.aliyuncs.com/20554_3.v1.1.fastGWA.gz"
"20553_5","Methods of self-harm used: Self-injury such as self-cutting, scratching or hitting, etc.","Binary","LR",20849,493,"","https://ukb-wes.oss-us-west-1.aliyuncs.com/20553_5.v1.1.fastGWA.gz"
"20480","Ever self-harmed","Binary","LR",20849,992,"","https://ukb-wes.oss-us-west-1.aliyuncs.com/20480.v1.1.fastGWA.gz"
"20521","Belittlement by partner or ex-partner as an adult","Ordered_Categorical","LR",20849,NA,"","https://ukb-wes.oss-us-west-1.aliyuncs.com/20521.v1.1.fastGWA.gz"
"20514","Recent lack of interest or pleasure in doing things","Ordered_Categorical","LR",20852,NA,"","https://ukb-wes.oss-us-west-1.aliyuncs.com/20514.v1.1.fastGWA.gz"
"20487","Felt hated by family member as a child","Ordered_Categorical","LR",20852,NA,"","https://ukb-wes.oss-us-west-1.aliyuncs.com/20487.v1.1.fastGWA.gz"
"20516","Recent restlessness","Ordered_Categorical","LR",20858,NA,"","https://ukb-wes.oss-us-west-1.aliyuncs.com/20516.v1.1.fastGWA.gz"
"20519","Recent feelings of tiredness or low energy","Ordered_Categorical","LR",20863,NA,"","https://ukb-wes.oss-us-west-1.aliyuncs.com/20519.v1.1.fastGWA.gz"
"20517","Trouble falling or staying asleep, or sleeping too much","Ordered_Categorical","LR",20863,NA,"","https://ukb-wes.oss-us-west-1.aliyuncs.com/20517.v1.1.fastGWA.gz"
"20488","Physically abused by family as a child","Ordered_Categorical","MLM",20863,NA,"","https://ukb-wes.oss-us-west-1.aliyuncs.com/20488.v1.1.fastGWA.gz"
"20547_3","Activities undertaken to treat depression: Other therapeutic activities such as mindfulness, yoga or art classes","Binary","LR",20866,1697,"","https://ukb-wes.oss-us-west-1.aliyuncs.com/20547_3.v1.1.fastGWA.gz"
"20547_1","Activities undertaken to treat depression: Talking therapies, such as psychotherapy, counselling, group therapy or CBT","Binary","LR",20866,4881,"","https://ukb-wes.oss-us-west-1.aliyuncs.com/20547_1.v1.1.fastGWA.gz"
"20546_4","Substances taken for depression: Drugs or alcohol (more than once)","Binary","LR",20866,1649,"","https://ukb-wes.oss-us-west-1.aliyuncs.com/20546_4.v1.1.fastGWA.gz"
"20446","Ever had prolonged feelings of sadness or depression","Binary","LR",20866,11636,"","https://ukb-wes.oss-us-west-1.aliyuncs.com/20446.v1.1.fastGWA.gz"
"20546_3","Substances taken for depression: Medication prescribed to you (for at least two weeks)","Binary","LR",20866,5252,"","https://ukb-wes.oss-us-west-1.aliyuncs.com/20546_3.v1.1.fastGWA.gz"
"20546_1","Substances taken for depression: Unprescribed medication (more than once)","Binary","LR",20866,769,"","https://ukb-wes.oss-us-west-1.aliyuncs.com/20546_1.v1.1.fastGWA.gz"
"20459","General happiness with own health","Ordered_Categorical","LR",20866,NA,"","https://ukb-wes.oss-us-west-1.aliyuncs.com/20459.v1.1.fastGWA.gz"
"20405_2","Ever had known person concerned about, or recommend reduction of, alcohol consumption: Yes, during the last year","Binary","LR",20870,903,"","https://ukb-wes.oss-us-west-1.aliyuncs.com/20405_2.v1.1.fastGWA.gz"
"20405_0","Ever had known person concerned about, or recommend reduction of, alcohol consumption: No","Binary","LR",20870,18931,"","https://ukb-wes.oss-us-west-1.aliyuncs.com/20405_0.v1.1.fastGWA.gz"
"20405_1","Ever had known person concerned about, or recommend reduction of, alcohol consumption: Yes, but not in the last year","Binary","LR",20870,1036,"","https://ukb-wes.oss-us-west-1.aliyuncs.com/20405_1.v1.1.fastGWA.gz"
"20529","Victim of physically violent crime","Binary","MLM",20870,4030,"","https://ukb-wes.oss-us-west-1.aliyuncs.com/20529.v1.1.fastGWA.gz"
"20518","Recent changes in speed/amount of moving or speaking","Ordered_Categorical","LR",20870,NA,"","https://ukb-wes.oss-us-west-1.aliyuncs.com/20518.v1.1.fastGWA.gz"
"20530","Witnessed sudden violent death","Binary","MLM",20871,2869,"","https://ukb-wes.oss-us-west-1.aliyuncs.com/20530.v1.1.fastGWA.gz"
"20508","Recent trouble concentrating on things","Ordered_Categorical","LR",20872,NA,"","https://ukb-wes.oss-us-west-1.aliyuncs.com/20508.v1.1.fastGWA.gz"
"20453","Ever taken cannabis","Ordered_Categorical","MLM",20874,NA,"","https://ukb-wes.oss-us-west-1.aliyuncs.com/20453.v1.1.fastGWA.gz"
"20511","Recent poor appetite or overeating","Ordered_Categorical","LR",20876,NA,"","https://ukb-wes.oss-us-west-1.aliyuncs.com/20511.v1.1.fastGWA.gz"
"20526","Been in serious accident believed to be life-threatening","Binary","LR",20878,2035,"","https://ukb-wes.oss-us-west-1.aliyuncs.com/20526.v1.1.fastGWA.gz"
"20497","Repeated disturbing thoughts of stressful experience in past month","Ordered_Categorical","LR",20878,NA,"","https://ukb-wes.oss-us-west-1.aliyuncs.com/20497.v1.1.fastGWA.gz"
"20414","Frequency of drinking alcohol","Ordered_Categorical","MLM",20882,NA,"","https://ukb-wes.oss-us-west-1.aliyuncs.com/20414.v1.1.fastGWA.gz"
"20495","Avoided activities or situations because of previous stressful experience in past month","Ordered_Categorical","LR",20884,NA,"","https://ukb-wes.oss-us-west-1.aliyuncs.com/20495.v1.1.fastGWA.gz"
"20527","Been involved in combat or exposed to war-zone","Binary","MLM",20886,630,"","https://ukb-wes.oss-us-west-1.aliyuncs.com/20527.v1.1.fastGWA.gz"
"20498","Felt very upset when reminded of stressful experience in past month","Ordered_Categorical","MLM",20888,NA,"","https://ukb-wes.oss-us-west-1.aliyuncs.com/20498.v1.1.fastGWA.gz"
"20411_0","Ever been injured or injured someone else through drinking alcohol: No","Binary","LR",20897,20026,"","https://ukb-wes.oss-us-west-1.aliyuncs.com/20411_0.v1.1.fastGWA.gz"
"20411_1","Ever been injured or injured someone else through drinking alcohol: Yes, but not in the last year","Binary","LR",20897,776,"","https://ukb-wes.oss-us-west-1.aliyuncs.com/20411_1.v1.1.fastGWA.gz"
"2724","Had menopause","Binary","LR",20906,14999,"YES","https://ukb-wes.oss-us-west-1.aliyuncs.com/2724.v1.1.fastGWA.gz"
"6177_1","Medication for cholesterol, blood pressure or diabetes: Cholesterol lowering medication","Binary","LR",20911,5080,"YES","https://ukb-wes.oss-us-west-1.aliyuncs.com/6177_1.v1.1.fastGWA.gz"
"6177_3","Medication for cholesterol, blood pressure or diabetes: Insulin","Binary","LR",20911,252,"YES","https://ukb-wes.oss-us-west-1.aliyuncs.com/6177_3.v1.1.fastGWA.gz"
"6177_2","Medication for cholesterol, blood pressure or diabetes: Blood pressure medication","Binary","MLM",20911,5163,"YES","https://ukb-wes.oss-us-west-1.aliyuncs.com/6177_2.v1.1.fastGWA.gz"
"6177_100","Medication for cholesterol, blood pressure or diabetes: PHESANT recoding","Binary","LR",20911,13788,"YES","https://ukb-wes.oss-us-west-1.aliyuncs.com/6177_100.v1.1.fastGWA.gz"
"2405","Number of children fathered","Ordered_Categorical","MLM",20924,NA,"YES","https://ukb-wes.oss-us-west-1.aliyuncs.com/2405.v1.1.fastGWA.gz"
"2395_3","Hair/balding pattern: Pattern 3","Binary","LR",20927,5616,"YES","https://ukb-wes.oss-us-west-1.aliyuncs.com/2395_3.v1.1.fastGWA.gz"
"2395_2","Hair/balding pattern: Pattern 2","Binary","LR",20927,4747,"YES","https://ukb-wes.oss-us-west-1.aliyuncs.com/2395_2.v1.1.fastGWA.gz"
"2395_4","Hair/balding pattern: Pattern 4","Binary","LR",20927,3875,"YES","https://ukb-wes.oss-us-west-1.aliyuncs.com/2395_4.v1.1.fastGWA.gz"
"2395_1","Hair/balding pattern: Pattern 1","Binary","LR",20927,6689,"YES","https://ukb-wes.oss-us-west-1.aliyuncs.com/2395_1.v1.1.fastGWA.gz"
"2415","Had major operations","Binary","LR",20943,13215,"YES","https://ukb-wes.oss-us-west-1.aliyuncs.com/2415.v1.1.fastGWA.gz"
"3591","Ever had hysterectomy (womb removed)","Binary","LR",22016,1704,"YES","https://ukb-wes.oss-us-west-1.aliyuncs.com/3591.v1.1.fastGWA.gz"
"3637","Frequency of other exercises in last 4 weeks","Ordered_Categorical","LR",22563,NA,"","https://ukb-wes.oss-us-west-1.aliyuncs.com/3637.v1.1.fastGWA.gz"
"3647","Duration of other exercises","Ordered_Categorical","LR",22598,NA,"","https://ukb-wes.oss-us-west-1.aliyuncs.com/3647.v1.1.fastGWA.gz"
"1021","Duration of light DIY","Ordered_Categorical","LR",23647,NA,"","https://ukb-wes.oss-us-west-1.aliyuncs.com/1021.v1.1.fastGWA.gz"
"1011","Frequency of light DIY in last 4 weeks","Ordered_Categorical","LR",23758,NA,"","https://ukb-wes.oss-us-west-1.aliyuncs.com/1011.v1.1.fastGWA.gz"
"2714","Age when periods started (menarche)","Ordered_Categorical","MLM",24450,NA,"YES","https://ukb-wes.oss-us-west-1.aliyuncs.com/2714.v1.1.fastGWA.gz"
"2654_2","Non-butter spread type details: Flora Pro-Active or Benecol","Binary","LR",24615,3919,"","https://ukb-wes.oss-us-west-1.aliyuncs.com/2654_2.v1.1.fastGWA.gz"
"2654_9","Non-butter spread type details: Other type of spread/margarine","Binary","LR",24615,899,"","https://ukb-wes.oss-us-west-1.aliyuncs.com/2654_9.v1.1.fastGWA.gz"
"2654_4","Non-butter spread type details: Soft (tub) margarine","Binary","LR",24615,2817,"","https://ukb-wes.oss-us-west-1.aliyuncs.com/2654_4.v1.1.fastGWA.gz"
"2654_8","Non-butter spread type details: Other low or reduced fat spread","Binary","MLM",24615,2393,"","https://ukb-wes.oss-us-west-1.aliyuncs.com/2654_8.v1.1.fastGWA.gz"
"2654_7","Non-butter spread type details: Polyunsaturated/sunflower oil based spread (eg: Flora)","Binary","LR",24615,8294,"","https://ukb-wes.oss-us-west-1.aliyuncs.com/2654_7.v1.1.fastGWA.gz"
"2654_6","Non-butter spread type details: Olive oil based spread (eg: Bertolli)","Binary","LR",24615,6269,"","https://ukb-wes.oss-us-west-1.aliyuncs.com/2654_6.v1.1.fastGWA.gz"
"2774","Ever had stillbirth, spontaneous miscarriage or termination","Binary","LR",24715,8180,"YES","https://ukb-wes.oss-us-west-1.aliyuncs.com/2774.v1.1.fastGWA.gz"
"2834","Bilateral oophorectomy (both ovaries removed)","Binary","MLM",24801,2114,"YES","https://ukb-wes.oss-us-west-1.aliyuncs.com/2834.v1.1.fastGWA.gz"
"2844","Had other major operations","Binary","LR",24913,16661,"YES","https://ukb-wes.oss-us-west-1.aliyuncs.com/2844.v1.1.fastGWA.gz"
"6153_4","Medication for cholesterol, blood pressure, diabetes, or take exogenous hormones: Hormone replacement therapy","Binary","LR",24981,1923,"YES","https://ukb-wes.oss-us-west-1.aliyuncs.com/6153_4.v1.1.fastGWA.gz"
"6153_5","Medication for cholesterol, blood pressure, diabetes, or take exogenous hormones: Oral contraceptive pill or minipill","Binary","LR",24981,622,"YES","https://ukb-wes.oss-us-west-1.aliyuncs.com/6153_5.v1.1.fastGWA.gz"
"6153_1","Medication for cholesterol, blood pressure, diabetes, or take exogenous hormones: Cholesterol lowering medication","Binary","MLM",24981,3152,"YES","https://ukb-wes.oss-us-west-1.aliyuncs.com/6153_1.v1.1.fastGWA.gz"
"6153_2","Medication for cholesterol, blood pressure, diabetes, or take exogenous hormones: Blood pressure medication","Binary","MLM",24981,4156,"YES","https://ukb-wes.oss-us-west-1.aliyuncs.com/6153_2.v1.1.fastGWA.gz"
"6153_100","Medication for cholesterol, blood pressure, diabetes, or take exogenous hormones: PHESANT recoding","Binary","MLM",24981,17328,"YES","https://ukb-wes.oss-us-west-1.aliyuncs.com/6153_100.v1.1.fastGWA.gz"
"2814","Ever used hormone-replacement therapy (HRT)","Binary","LR",25042,9753,"YES","https://ukb-wes.oss-us-west-1.aliyuncs.com/2814.v1.1.fastGWA.gz"
"2784","Ever taken oral contraceptive pill","Binary","MLM",25057,21026,"YES","https://ukb-wes.oss-us-west-1.aliyuncs.com/2784.v1.1.fastGWA.gz"
"2734","Number of live births","Ordered_Categorical","LR",25087,NA,"YES","https://ukb-wes.oss-us-west-1.aliyuncs.com/2734.v1.1.fastGWA.gz"
"4537","Work/job satisfaction","Ordered_Categorical","LR",25633,NA,"","https://ukb-wes.oss-us-west-1.aliyuncs.com/4537.v1.1.fastGWA.gz"
"767","Length of working week for main job","Continuous","LR",25910,NA,"","https://ukb-wes.oss-us-west-1.aliyuncs.com/767.v1.1.fastGWA.gz"
"914","Duration of vigorous activity","Continuous","LR",26189,NA,"","https://ukb-wes.oss-us-west-1.aliyuncs.com/914.v1.1.fastGWA.gz"
"826","Job involves shift work","Ordered_Categorical","MLM",26234,NA,"","https://ukb-wes.oss-us-west-1.aliyuncs.com/826.v1.1.fastGWA.gz"
"806","Job involves mainly walking or standing","Ordered_Categorical","MLM",26258,NA,"","https://ukb-wes.oss-us-west-1.aliyuncs.com/806.v1.1.fastGWA.gz"
"816","Job involves heavy manual or physical work","Ordered_Categorical","MLM",26260,NA,"","https://ukb-wes.oss-us-west-1.aliyuncs.com/816.v1.1.fastGWA.gz"
"5364","Average weekly intake of other alcoholic drinks","Ordered_Categorical","LR",26466,NA,"","https://ukb-wes.oss-us-west-1.aliyuncs.com/5364.v1.1.fastGWA.gz"
"3526","Mother's age at death","Continuous","MLM",26972,NA,"","https://ukb-wes.oss-us-west-1.aliyuncs.com/3526.v1.1.fastGWA.gz"
"20126_4","Bipolar and major depression status: Probable Recurrent major depression (moderate)","Binary","LR",27088,3606,"","https://ukb-wes.oss-us-west-1.aliyuncs.com/20126_4.v1.1.fastGWA.gz"
"20126_5","Bipolar and major depression status: Single Probable major depression episode","Binary","LR",27088,1900,"","https://ukb-wes.oss-us-west-1.aliyuncs.com/20126_5.v1.1.fastGWA.gz"
"20126_3","Bipolar and major depression status: Probable Recurrent major depression (severe)","Binary","MLM",27088,2084,"","https://ukb-wes.oss-us-west-1.aliyuncs.com/20126_3.v1.1.fastGWA.gz"
"20126_0","Bipolar and major depression status: No Bipolar or Depression","Binary","MLM",27088,19159,"","https://ukb-wes.oss-us-west-1.aliyuncs.com/20126_0.v1.1.fastGWA.gz"
"110005","Invitation to physical activity study, acceptance","Binary","LR",27125,14201,"","https://ukb-wes.oss-us-west-1.aliyuncs.com/110005.v1.1.fastGWA.gz"
"1618","Alcohol usually taken with meals","Binary","MLM",27217,19069,"","https://ukb-wes.oss-us-west-1.aliyuncs.com/1618.v1.1.fastGWA.gz"
"20022","Birth weight","Continuous","MLM",27450,NA,"","https://ukb-wes.oss-us-west-1.aliyuncs.com/20022.v1.1.fastGWA.gz"
"845","Age completed full time education","Ordered_Categorical","MLM",29619,NA,"","https://ukb-wes.oss-us-west-1.aliyuncs.com/845.v1.1.fastGWA.gz"
"1090","Time spent driving","Ordered_Categorical","LR",30147,NA,"","https://ukb-wes.oss-us-west-1.aliyuncs.com/1090.v1.1.fastGWA.gz"
"20077","Number of diet questionnaires completed","Ordered_Categorical","MLM",30279,NA,"","https://ukb-wes.oss-us-west-1.aliyuncs.com/20077.v1.1.fastGWA.gz"
"5057","Number of older siblings","Ordered_Categorical","LR",32335,NA,"","https://ukb-wes.oss-us-west-1.aliyuncs.com/5057.v1.1.fastGWA.gz"
"1598","Average weekly spirits intake","Ordered_Categorical","MLM",32877,NA,"","https://ukb-wes.oss-us-west-1.aliyuncs.com/1598.v1.1.fastGWA.gz"
"1578","Average weekly champagne plus white wine intake","Ordered_Categorical","MLM",32889,NA,"","https://ukb-wes.oss-us-west-1.aliyuncs.com/1578.v1.1.fastGWA.gz"
"1568","Average weekly red wine intake","Ordered_Categorical","MLM",32911,NA,"","https://ukb-wes.oss-us-west-1.aliyuncs.com/1568.v1.1.fastGWA.gz"
"1608","Average weekly fortified wine intake","Ordered_Categorical","LR",32952,NA,"","https://ukb-wes.oss-us-west-1.aliyuncs.com/1608.v1.1.fastGWA.gz"
"1588","Average weekly beer plus cider intake","Ordered_Categorical","MLM",32957,NA,"","https://ukb-wes.oss-us-west-1.aliyuncs.com/1588.v1.1.fastGWA.gz"
"981","Duration walking for pleasure","Ordered_Categorical","LR",33328,NA,"","https://ukb-wes.oss-us-west-1.aliyuncs.com/981.v1.1.fastGWA.gz"
"971","Frequency of walking for pleasure in last 4 weeks","Ordered_Categorical","LR",33354,NA,"","https://ukb-wes.oss-us-west-1.aliyuncs.com/971.v1.1.fastGWA.gz"
"1807","Father's age at death","Continuous","MLM",33884,NA,"","https://ukb-wes.oss-us-west-1.aliyuncs.com/1807.v1.1.fastGWA.gz"
"6017","Able to walk or cycle unaided for 10 minutes","Binary","LR",34432,33176,"","https://ukb-wes.oss-us-west-1.aliyuncs.com/6017.v1.1.fastGWA.gz"
"20152","Reproduciblity of spirometry measurement using ERS/ATS criteria","Binary","LR",34458,27741,"","https://ukb-wes.oss-us-west-1.aliyuncs.com/20152.v1.1.fastGWA.gz"
"20151","Forced vital capacity (FVC), Best measure","Continuous","MLM",34458,NA,"","https://ukb-wes.oss-us-west-1.aliyuncs.com/20151.v1.1.fastGWA.gz"
"20150","Forced expiratory volume in 1-second (FEV1), Best measure","Continuous","MLM",34458,NA,"","https://ukb-wes.oss-us-west-1.aliyuncs.com/20150.v1.1.fastGWA.gz"
"5983","ECG, heart rate","Continuous","LR",34559,NA,"","https://ukb-wes.oss-us-west-1.aliyuncs.com/5983.v1.1.fastGWA.gz"
"5985","Bicycle speed","Continuous","LR",34597,NA,"","https://ukb-wes.oss-us-west-1.aliyuncs.com/5985.v1.1.fastGWA.gz"
