"ID","Description","Data_type","Method","N","Ncase","Gender_specific","URL"
"25113","Mean MD in medial lemniscus on FA skeleton (left)","Continuous","LR",9859,NA,"","https://ukb-wes.oss-us-west-1.aliyuncs.com/25113.v1.1.fastGWA.gz"
"25083","Mean FA in posterior corona radiata on FA skeleton (left)","Continuous","LR",9859,NA,"","https://ukb-wes.oss-us-west-1.aliyuncs.com/25083.v1.1.fastGWA.gz"
"25198","Mean MO in tapetum on FA skeleton (right)","Continuous","LR",9859,NA,"","https://ukb-wes.oss-us-west-1.aliyuncs.com/25198.v1.1.fastGWA.gz"
"25065","Mean FA in medial lemniscus on FA skeleton (left)","Continuous","LR",9859,NA,"","https://ukb-wes.oss-us-west-1.aliyuncs.com/25065.v1.1.fastGWA.gz"
"25272","Mean L2 in superior corona radiata on FA skeleton (right)","Continuous","LR",9859,NA,"","https://ukb-wes.oss-us-west-1.aliyuncs.com/25272.v1.1.fastGWA.gz"
"25143","Mean MD in fornix cres+stria terminalis on FA skeleton (left)","Continuous","LR",9859,NA,"","https://ukb-wes.oss-us-west-1.aliyuncs.com/25143.v1.1.fastGWA.gz"
"25121","Mean MD in anterior limb of internal capsule on FA skeleton (left)","Continuous","LR",9859,NA,"","https://ukb-wes.oss-us-west-1.aliyuncs.com/25121.v1.1.fastGWA.gz"
"25274","Mean L2 in posterior corona radiata on FA skeleton (right)","Continuous","LR",9859,NA,"","https://ukb-wes.oss-us-west-1.aliyuncs.com/25274.v1.1.fastGWA.gz"
"25191","Mean MO in fornix cres+stria terminalis on FA skeleton (left)","Continuous","LR",9859,NA,"","https://ukb-wes.oss-us-west-1.aliyuncs.com/25191.v1.1.fastGWA.gz"
"25082","Mean FA in posterior corona radiata on FA skeleton (right)","Continuous","LR",9859,NA,"","https://ukb-wes.oss-us-west-1.aliyuncs.com/25082.v1.1.fastGWA.gz"
"25339","Mean L3 in superior fronto-occipital fasciculus on FA skeleton (left)","Continuous","LR",9859,NA,"","https://ukb-wes.oss-us-west-1.aliyuncs.com/25339.v1.1.fastGWA.gz"
"25194","Mean MO in superior fronto-occipital fasciculus on FA skeleton (right)","Continuous","LR",9859,NA,"","https://ukb-wes.oss-us-west-1.aliyuncs.com/25194.v1.1.fastGWA.gz"
"25112","Mean MD in medial lemniscus on FA skeleton (right)","Continuous","LR",9859,NA,"","https://ukb-wes.oss-us-west-1.aliyuncs.com/25112.v1.1.fastGWA.gz"
"25187","Mean MO in cingulum cingulate gyrus on FA skeleton (left)","Continuous","LR",9859,NA,"","https://ukb-wes.oss-us-west-1.aliyuncs.com/25187.v1.1.fastGWA.gz"
"25148","Mean MD in uncinate fasciculus on FA skeleton (right)","Continuous","LR",9859,NA,"","https://ukb-wes.oss-us-west-1.aliyuncs.com/25148.v1.1.fastGWA.gz"
"25114","Mean MD in inferior cerebellar peduncle on FA skeleton (right)","Continuous","LR",9859,NA,"","https://ukb-wes.oss-us-west-1.aliyuncs.com/25114.v1.1.fastGWA.gz"
"25213","Mean L1 in superior cerebellar peduncle on FA skeleton (left)","Continuous","LR",9859,NA,"","https://ukb-wes.oss-us-west-1.aliyuncs.com/25213.v1.1.fastGWA.gz"
"25338","Mean L3 in superior fronto-occipital fasciculus on FA skeleton (right)","Continuous","LR",9859,NA,"","https://ukb-wes.oss-us-west-1.aliyuncs.com/25338.v1.1.fastGWA.gz"
"25235","Mean L1 in cingulum cingulate gyrus on FA skeleton (left)","Continuous","LR",9859,NA,"","https://ukb-wes.oss-us-west-1.aliyuncs.com/25235.v1.1.fastGWA.gz"
"25181","Mean MO in posterior thalamic radiation on FA skeleton (left)","Continuous","LR",9859,NA,"","https://ukb-wes.oss-us-west-1.aliyuncs.com/25181.v1.1.fastGWA.gz"
"25142","Mean MD in fornix cres+stria terminalis on FA skeleton (right)","Continuous","MLM",9859,NA,"","https://ukb-wes.oss-us-west-1.aliyuncs.com/25142.v1.1.fastGWA.gz"
"25206","Mean L1 in corticospinal tract on FA skeleton (right)","Continuous","LR",9859,NA,"","https://ukb-wes.oss-us-west-1.aliyuncs.com/25206.v1.1.fastGWA.gz"
"25304","Mean L3 in medial lemniscus on FA skeleton (right)","Continuous","LR",9859,NA,"","https://ukb-wes.oss-us-west-1.aliyuncs.com/25304.v1.1.fastGWA.gz"
"25305","Mean L3 in medial lemniscus on FA skeleton (left)","Continuous","LR",9859,NA,"","https://ukb-wes.oss-us-west-1.aliyuncs.com/25305.v1.1.fastGWA.gz"
"25140","Mean MD in cingulum hippocampus on FA skeleton (right)","Continuous","LR",9859,NA,"","https://ukb-wes.oss-us-west-1.aliyuncs.com/25140.v1.1.fastGWA.gz"
"25220","Mean L1 in retrolenticular part of internal capsule on FA skeleton (right)","Continuous","LR",9859,NA,"","https://ukb-wes.oss-us-west-1.aliyuncs.com/25220.v1.1.fastGWA.gz"
"25064","Mean FA in medial lemniscus on FA skeleton (right)","Continuous","LR",9859,NA,"","https://ukb-wes.oss-us-west-1.aliyuncs.com/25064.v1.1.fastGWA.gz"
"25287","Mean L2 in fornix cres+stria terminalis on FA skeleton (left)","Continuous","LR",9859,NA,"","https://ukb-wes.oss-us-west-1.aliyuncs.com/25287.v1.1.fastGWA.gz"
"25257","Mean L2 in medial lemniscus on FA skeleton (left)","Continuous","LR",9859,NA,"","https://ukb-wes.oss-us-west-1.aliyuncs.com/25257.v1.1.fastGWA.gz"
"25173","Mean MO in retrolenticular part of internal capsule on FA skeleton (left)","Continuous","LR",9859,NA,"","https://ukb-wes.oss-us-west-1.aliyuncs.com/25173.v1.1.fastGWA.gz"
"25333","Mean L3 in cingulum hippocampus on FA skeleton (left)","Continuous","LR",9859,NA,"","https://ukb-wes.oss-us-west-1.aliyuncs.com/25333.v1.1.fastGWA.gz"
"25207","Mean L1 in corticospinal tract on FA skeleton (left)","Continuous","LR",9859,NA,"","https://ukb-wes.oss-us-west-1.aliyuncs.com/25207.v1.1.fastGWA.gz"
"25244","Mean L1 in uncinate fasciculus on FA skeleton (right)","Continuous","LR",9859,NA,"","https://ukb-wes.oss-us-west-1.aliyuncs.com/25244.v1.1.fastGWA.gz"
"25157","Mean MO in fornix on FA skeleton","Continuous","LR",9859,NA,"","https://ukb-wes.oss-us-west-1.aliyuncs.com/25157.v1.1.fastGWA.gz"
"25332","Mean L3 in cingulum hippocampus on FA skeleton (right)","Continuous","LR",9859,NA,"","https://ukb-wes.oss-us-west-1.aliyuncs.com/25332.v1.1.fastGWA.gz"
"25297","Mean L3 in pontine crossing tract on FA skeleton","Continuous","LR",9859,NA,"","https://ukb-wes.oss-us-west-1.aliyuncs.com/25297.v1.1.fastGWA.gz"
"25234","Mean L1 in cingulum cingulate gyrus on FA skeleton (right)","Continuous","LR",9859,NA,"","https://ukb-wes.oss-us-west-1.aliyuncs.com/25234.v1.1.fastGWA.gz"
"25183","Mean MO in sagittal stratum on FA skeleton (left)","Continuous","LR",9859,NA,"","https://ukb-wes.oss-us-west-1.aliyuncs.com/25183.v1.1.fastGWA.gz"
"25105","Mean MD in pontine crossing tract on FA skeleton","Continuous","LR",9859,NA,"","https://ukb-wes.oss-us-west-1.aliyuncs.com/25105.v1.1.fastGWA.gz"
"25067","Mean FA in inferior cerebellar peduncle on FA skeleton (left)","Continuous","LR",9859,NA,"","https://ukb-wes.oss-us-west-1.aliyuncs.com/25067.v1.1.fastGWA.gz"
"25195","Mean MO in superior fronto-occipital fasciculus on FA skeleton (left)","Continuous","LR",9859,NA,"","https://ukb-wes.oss-us-west-1.aliyuncs.com/25195.v1.1.fastGWA.gz"
"25334","Mean L3 in fornix cres+stria terminalis on FA skeleton (right)","Continuous","LR",9859,NA,"","https://ukb-wes.oss-us-west-1.aliyuncs.com/25334.v1.1.fastGWA.gz"
"25245","Mean L1 in uncinate fasciculus on FA skeleton (left)","Continuous","LR",9859,NA,"","https://ukb-wes.oss-us-west-1.aliyuncs.com/25245.v1.1.fastGWA.gz"
"25163","Mean MO in inferior cerebellar peduncle on FA skeleton (left)","Continuous","LR",9859,NA,"","https://ukb-wes.oss-us-west-1.aliyuncs.com/25163.v1.1.fastGWA.gz"
"25256","Mean L2 in medial lemniscus on FA skeleton (right)","Continuous","LR",9859,NA,"","https://ukb-wes.oss-us-west-1.aliyuncs.com/25256.v1.1.fastGWA.gz"
"25115","Mean MD in inferior cerebellar peduncle on FA skeleton (left)","Continuous","LR",9859,NA,"","https://ukb-wes.oss-us-west-1.aliyuncs.com/25115.v1.1.fastGWA.gz"
"25057","Mean FA in pontine crossing tract on FA skeleton","Continuous","LR",9859,NA,"","https://ukb-wes.oss-us-west-1.aliyuncs.com/25057.v1.1.fastGWA.gz"
"25186","Mean MO in cingulum cingulate gyrus on FA skeleton (right)","Continuous","LR",9859,NA,"","https://ukb-wes.oss-us-west-1.aliyuncs.com/25186.v1.1.fastGWA.gz"
"25249","Mean L2 in pontine crossing tract on FA skeleton","Continuous","LR",9859,NA,"","https://ukb-wes.oss-us-west-1.aliyuncs.com/25249.v1.1.fastGWA.gz"
"25259","Mean L2 in inferior cerebellar peduncle on FA skeleton (left)","Continuous","LR",9859,NA,"","https://ukb-wes.oss-us-west-1.aliyuncs.com/25259.v1.1.fastGWA.gz"
"25306","Mean L3 in inferior cerebellar peduncle on FA skeleton (right)","Continuous","LR",9859,NA,"","https://ukb-wes.oss-us-west-1.aliyuncs.com/25306.v1.1.fastGWA.gz"
"25307","Mean L3 in inferior cerebellar peduncle on FA skeleton (left)","Continuous","LR",9859,NA,"","https://ukb-wes.oss-us-west-1.aliyuncs.com/25307.v1.1.fastGWA.gz"
"25168","Mean MO in anterior limb of internal capsule on FA skeleton (right)","Continuous","MLM",9859,NA,"","https://ukb-wes.oss-us-west-1.aliyuncs.com/25168.v1.1.fastGWA.gz"
"25103","Mean FA in tapetum on FA skeleton (left)","Continuous","MLM",9859,NA,"","https://ukb-wes.oss-us-west-1.aliyuncs.com/25103.v1.1.fastGWA.gz"
"25293","Mean L2 in uncinate fasciculus on FA skeleton (left)","Continuous","MLM",9859,NA,"","https://ukb-wes.oss-us-west-1.aliyuncs.com/25293.v1.1.fastGWA.gz"
"25078","Mean FA in anterior corona radiata on FA skeleton (right)","Continuous","MLM",9859,NA,"","https://ukb-wes.oss-us-west-1.aliyuncs.com/25078.v1.1.fastGWA.gz"
"25088","Mean FA in external capsule on FA skeleton (right)","Continuous","MLM",9859,NA,"","https://ukb-wes.oss-us-west-1.aliyuncs.com/25088.v1.1.fastGWA.gz"
"25169","Mean MO in anterior limb of internal capsule on FA skeleton (left)","Continuous","MLM",9859,NA,"","https://ukb-wes.oss-us-west-1.aliyuncs.com/25169.v1.1.fastGWA.gz"
"25216","Mean L1 in anterior limb of internal capsule on FA skeleton (right)","Continuous","MLM",9859,NA,"","https://ukb-wes.oss-us-west-1.aliyuncs.com/25216.v1.1.fastGWA.gz"
"25242","Mean L1 in superior fronto-occipital fasciculus on FA skeleton (right)","Continuous","MLM",9859,NA,"","https://ukb-wes.oss-us-west-1.aliyuncs.com/25242.v1.1.fastGWA.gz"
"25167","Mean MO in cerebral peduncle on FA skeleton (left)","Continuous","MLM",9859,NA,"","https://ukb-wes.oss-us-west-1.aliyuncs.com/25167.v1.1.fastGWA.gz"
"25328","Mean L3 in external capsule on FA skeleton (right)","Continuous","MLM",9859,NA,"","https://ukb-wes.oss-us-west-1.aliyuncs.com/25328.v1.1.fastGWA.gz"
"25264","Mean L2 in anterior limb of internal capsule on FA skeleton (right)","Continuous","MLM",9859,NA,"","https://ukb-wes.oss-us-west-1.aliyuncs.com/25264.v1.1.fastGWA.gz"
"25331","Mean L3 in cingulum cingulate gyrus on FA skeleton (left)","Continuous","MLM",9859,NA,"","https://ukb-wes.oss-us-west-1.aliyuncs.com/25331.v1.1.fastGWA.gz"
"25100","Mean FA in uncinate fasciculus on FA skeleton (right)","Continuous","MLM",9859,NA,"","https://ukb-wes.oss-us-west-1.aliyuncs.com/25100.v1.1.fastGWA.gz"
"25224","Mean L1 in superior corona radiata on FA skeleton (right)","Continuous","MLM",9859,NA,"","https://ukb-wes.oss-us-west-1.aliyuncs.com/25224.v1.1.fastGWA.gz"
"25241","Mean L1 in superior longitudinal fasciculus on FA skeleton (left)","Continuous","MLM",9859,NA,"","https://ukb-wes.oss-us-west-1.aliyuncs.com/25241.v1.1.fastGWA.gz"
"25280","Mean L2 in external capsule on FA skeleton (right)","Continuous","MLM",9859,NA,"","https://ukb-wes.oss-us-west-1.aliyuncs.com/25280.v1.1.fastGWA.gz"
"25073","Mean FA in anterior limb of internal capsule on FA skeleton (left)","Continuous","MLM",9859,NA,"","https://ukb-wes.oss-us-west-1.aliyuncs.com/25073.v1.1.fastGWA.gz"
"25125","Mean MD in retrolenticular part of internal capsule on FA skeleton (left)","Continuous","MLM",9859,NA,"","https://ukb-wes.oss-us-west-1.aliyuncs.com/25125.v1.1.fastGWA.gz"
"25270","Mean L2 in anterior corona radiata on FA skeleton (right)","Continuous","MLM",9859,NA,"","https://ukb-wes.oss-us-west-1.aliyuncs.com/25270.v1.1.fastGWA.gz"
"25120","Mean MD in anterior limb of internal capsule on FA skeleton (right)","Continuous","MLM",9859,NA,"","https://ukb-wes.oss-us-west-1.aliyuncs.com/25120.v1.1.fastGWA.gz"
"25342","Mean L3 in tapetum on FA skeleton (right)","Continuous","MLM",9859,NA,"","https://ukb-wes.oss-us-west-1.aliyuncs.com/25342.v1.1.fastGWA.gz"
"25225","Mean L1 in superior corona radiata on FA skeleton (left)","Continuous","MLM",9859,NA,"","https://ukb-wes.oss-us-west-1.aliyuncs.com/25225.v1.1.fastGWA.gz"
"25317","Mean L3 in retrolenticular part of internal capsule on FA skeleton (left)","Continuous","MLM",9859,NA,"","https://ukb-wes.oss-us-west-1.aliyuncs.com/25317.v1.1.fastGWA.gz"
"25343","Mean L3 in tapetum on FA skeleton (left)","Continuous","MLM",9859,NA,"","https://ukb-wes.oss-us-west-1.aliyuncs.com/25343.v1.1.fastGWA.gz"
"25070","Mean FA in cerebral peduncle on FA skeleton (right)","Continuous","MLM",9859,NA,"","https://ukb-wes.oss-us-west-1.aliyuncs.com/25070.v1.1.fastGWA.gz"
"25309","Mean L3 in superior cerebellar peduncle on FA skeleton (left)","Continuous","MLM",9859,NA,"","https://ukb-wes.oss-us-west-1.aliyuncs.com/25309.v1.1.fastGWA.gz"
"25101","Mean FA in uncinate fasciculus on FA skeleton (left)","Continuous","MLM",9859,NA,"","https://ukb-wes.oss-us-west-1.aliyuncs.com/25101.v1.1.fastGWA.gz"
"25193","Mean MO in superior longitudinal fasciculus on FA skeleton (left)","Continuous","MLM",9859,NA,"","https://ukb-wes.oss-us-west-1.aliyuncs.com/25193.v1.1.fastGWA.gz"
"25075","Mean FA in posterior limb of internal capsule on FA skeleton (left)","Continuous","MLM",9859,NA,"","https://ukb-wes.oss-us-west-1.aliyuncs.com/25075.v1.1.fastGWA.gz"
"25079","Mean FA in anterior corona radiata on FA skeleton (left)","Continuous","MLM",9859,NA,"","https://ukb-wes.oss-us-west-1.aliyuncs.com/25079.v1.1.fastGWA.gz"
"25199","Mean MO in tapetum on FA skeleton (left)","Continuous","MLM",9859,NA,"","https://ukb-wes.oss-us-west-1.aliyuncs.com/25199.v1.1.fastGWA.gz"
"25174","Mean MO in anterior corona radiata on FA skeleton (right)","Continuous","MLM",9859,NA,"","https://ukb-wes.oss-us-west-1.aliyuncs.com/25174.v1.1.fastGWA.gz"
"25271","Mean L2 in anterior corona radiata on FA skeleton (left)","Continuous","MLM",9859,NA,"","https://ukb-wes.oss-us-west-1.aliyuncs.com/25271.v1.1.fastGWA.gz"
"25281","Mean L2 in external capsule on FA skeleton (left)","Continuous","MLM",9859,NA,"","https://ukb-wes.oss-us-west-1.aliyuncs.com/25281.v1.1.fastGWA.gz"
"25072","Mean FA in anterior limb of internal capsule on FA skeleton (right)","Continuous","MLM",9859,NA,"","https://ukb-wes.oss-us-west-1.aliyuncs.com/25072.v1.1.fastGWA.gz"
"25150","Mean MD in tapetum on FA skeleton (right)","Continuous","MLM",9859,NA,"","https://ukb-wes.oss-us-west-1.aliyuncs.com/25150.v1.1.fastGWA.gz"
"25139","Mean MD in cingulum cingulate gyrus on FA skeleton (left)","Continuous","MLM",9859,NA,"","https://ukb-wes.oss-us-west-1.aliyuncs.com/25139.v1.1.fastGWA.gz"
"25154","Mean MO in genu of corpus callosum on FA skeleton","Continuous","MLM",9859,NA,"","https://ukb-wes.oss-us-west-1.aliyuncs.com/25154.v1.1.fastGWA.gz"
"25089","Mean FA in external capsule on FA skeleton (left)","Continuous","MLM",9859,NA,"","https://ukb-wes.oss-us-west-1.aliyuncs.com/25089.v1.1.fastGWA.gz"
"25253","Mean L2 in fornix on FA skeleton","Continuous","MLM",9859,NA,"","https://ukb-wes.oss-us-west-1.aliyuncs.com/25253.v1.1.fastGWA.gz"
"25329","Mean L3 in external capsule on FA skeleton (left)","Continuous","MLM",9859,NA,"","https://ukb-wes.oss-us-west-1.aliyuncs.com/25329.v1.1.fastGWA.gz"
"25292","Mean L2 in uncinate fasciculus on FA skeleton (right)","Continuous","MLM",9859,NA,"","https://ukb-wes.oss-us-west-1.aliyuncs.com/25292.v1.1.fastGWA.gz"
"25190","Mean MO in fornix cres+stria terminalis on FA skeleton (right)","Continuous","MLM",9859,NA,"","https://ukb-wes.oss-us-west-1.aliyuncs.com/25190.v1.1.fastGWA.gz"
"25300","Mean L3 in splenium of corpus callosum on FA skeleton","Continuous","MLM",9859,NA,"","https://ukb-wes.oss-us-west-1.aliyuncs.com/25300.v1.1.fastGWA.gz"
"25156","Mean MO in splenium of corpus callosum on FA skeleton","Continuous","MLM",9859,NA,"","https://ukb-wes.oss-us-west-1.aliyuncs.com/25156.v1.1.fastGWA.gz"
"25062","Mean FA in corticospinal tract on FA skeleton (right)","Continuous","MLM",9859,NA,"","https://ukb-wes.oss-us-west-1.aliyuncs.com/25062.v1.1.fastGWA.gz"
"25069","Mean FA in superior cerebellar peduncle on FA skeleton (left)","Continuous","MLM",9859,NA,"","https://ukb-wes.oss-us-west-1.aliyuncs.com/25069.v1.1.fastGWA.gz"
"25298","Mean L3 in genu of corpus callosum on FA skeleton","Continuous","MLM",9859,NA,"","https://ukb-wes.oss-us-west-1.aliyuncs.com/25298.v1.1.fastGWA.gz"
"25222","Mean L1 in anterior corona radiata on FA skeleton (right)","Continuous","MLM",9859,NA,"","https://ukb-wes.oss-us-west-1.aliyuncs.com/25222.v1.1.fastGWA.gz"
"25061","Mean FA in fornix on FA skeleton","Continuous","MLM",9859,NA,"","https://ukb-wes.oss-us-west-1.aliyuncs.com/25061.v1.1.fastGWA.gz"
"25056","Mean FA in middle cerebellar peduncle on FA skeleton","Continuous","MLM",9859,NA,"","https://ukb-wes.oss-us-west-1.aliyuncs.com/25056.v1.1.fastGWA.gz"
"25261","Mean L2 in superior cerebellar peduncle on FA skeleton (left)","Continuous","MLM",9859,NA,"","https://ukb-wes.oss-us-west-1.aliyuncs.com/25261.v1.1.fastGWA.gz"
"25129","Mean MD in superior corona radiata on FA skeleton (left)","Continuous","MLM",9859,NA,"","https://ukb-wes.oss-us-west-1.aliyuncs.com/25129.v1.1.fastGWA.gz"
"25218","Mean L1 in posterior limb of internal capsule on FA skeleton (right)","Continuous","MLM",9859,NA,"","https://ukb-wes.oss-us-west-1.aliyuncs.com/25218.v1.1.fastGWA.gz"
"25283","Mean L2 in cingulum cingulate gyrus on FA skeleton (left)","Continuous","MLM",9859,NA,"","https://ukb-wes.oss-us-west-1.aliyuncs.com/25283.v1.1.fastGWA.gz"
"25318","Mean L3 in anterior corona radiata on FA skeleton (right)","Continuous","MLM",9859,NA,"","https://ukb-wes.oss-us-west-1.aliyuncs.com/25318.v1.1.fastGWA.gz"
"25260","Mean L2 in superior cerebellar peduncle on FA skeleton (right)","Continuous","MLM",9859,NA,"","https://ukb-wes.oss-us-west-1.aliyuncs.com/25260.v1.1.fastGWA.gz"
"25063","Mean FA in corticospinal tract on FA skeleton (left)","Continuous","MLM",9859,NA,"","https://ukb-wes.oss-us-west-1.aliyuncs.com/25063.v1.1.fastGWA.gz"
"25136","Mean MD in external capsule on FA skeleton (right)","Continuous","MLM",9859,NA,"","https://ukb-wes.oss-us-west-1.aliyuncs.com/25136.v1.1.fastGWA.gz"
"25294","Mean L2 in tapetum on FA skeleton (right)","Continuous","MLM",9859,NA,"","https://ukb-wes.oss-us-west-1.aliyuncs.com/25294.v1.1.fastGWA.gz"
"25340","Mean L3 in uncinate fasciculus on FA skeleton (right)","Continuous","MLM",9859,NA,"","https://ukb-wes.oss-us-west-1.aliyuncs.com/25340.v1.1.fastGWA.gz"
"25289","Mean L2 in superior longitudinal fasciculus on FA skeleton (left)","Continuous","MLM",9859,NA,"","https://ukb-wes.oss-us-west-1.aliyuncs.com/25289.v1.1.fastGWA.gz"
"25096","Mean FA in superior longitudinal fasciculus on FA skeleton (right)","Continuous","MLM",9859,NA,"","https://ukb-wes.oss-us-west-1.aliyuncs.com/25096.v1.1.fastGWA.gz"
"25155","Mean MO in body of corpus callosum on FA skeleton","Continuous","MLM",9859,NA,"","https://ukb-wes.oss-us-west-1.aliyuncs.com/25155.v1.1.fastGWA.gz"
"25336","Mean L3 in superior longitudinal fasciculus on FA skeleton (right)","Continuous","MLM",9859,NA,"","https://ukb-wes.oss-us-west-1.aliyuncs.com/25336.v1.1.fastGWA.gz"
"25321","Mean L3 in superior corona radiata on FA skeleton (left)","Continuous","MLM",9859,NA,"","https://ukb-wes.oss-us-west-1.aliyuncs.com/25321.v1.1.fastGWA.gz"
"25268","Mean L2 in retrolenticular part of internal capsule on FA skeleton (right)","Continuous","MLM",9859,NA,"","https://ukb-wes.oss-us-west-1.aliyuncs.com/25268.v1.1.fastGWA.gz"
"25145","Mean MD in superior longitudinal fasciculus on FA skeleton (left)","Continuous","MLM",9859,NA,"","https://ukb-wes.oss-us-west-1.aliyuncs.com/25145.v1.1.fastGWA.gz"
"25219","Mean L1 in posterior limb of internal capsule on FA skeleton (left)","Continuous","MLM",9859,NA,"","https://ukb-wes.oss-us-west-1.aliyuncs.com/25219.v1.1.fastGWA.gz"
"25137","Mean MD in external capsule on FA skeleton (left)","Continuous","MLM",9859,NA,"","https://ukb-wes.oss-us-west-1.aliyuncs.com/25137.v1.1.fastGWA.gz"
"25177","Mean MO in superior corona radiata on FA skeleton (left)","Continuous","MLM",9859,NA,"","https://ukb-wes.oss-us-west-1.aliyuncs.com/25177.v1.1.fastGWA.gz"
"25135","Mean MD in sagittal stratum on FA skeleton (left)","Continuous","MLM",9859,NA,"","https://ukb-wes.oss-us-west-1.aliyuncs.com/25135.v1.1.fastGWA.gz"
"25327","Mean L3 in sagittal stratum on FA skeleton (left)","Continuous","MLM",9859,NA,"","https://ukb-wes.oss-us-west-1.aliyuncs.com/25327.v1.1.fastGWA.gz"
"25267","Mean L2 in posterior limb of internal capsule on FA skeleton (left)","Continuous","MLM",9859,NA,"","https://ukb-wes.oss-us-west-1.aliyuncs.com/25267.v1.1.fastGWA.gz"
"25108","Mean MD in splenium of corpus callosum on FA skeleton","Continuous","MLM",9859,NA,"","https://ukb-wes.oss-us-west-1.aliyuncs.com/25108.v1.1.fastGWA.gz"
"25197","Mean MO in uncinate fasciculus on FA skeleton (left)","Continuous","MLM",9859,NA,"","https://ukb-wes.oss-us-west-1.aliyuncs.com/25197.v1.1.fastGWA.gz"
"25122","Mean MD in posterior limb of internal capsule on FA skeleton (right)","Continuous","MLM",9859,NA,"","https://ukb-wes.oss-us-west-1.aliyuncs.com/25122.v1.1.fastGWA.gz"
"25152","Mean MO in middle cerebellar peduncle on FA skeleton","Continuous","MLM",9859,NA,"","https://ukb-wes.oss-us-west-1.aliyuncs.com/25152.v1.1.fastGWA.gz"
"25126","Mean MD in anterior corona radiata on FA skeleton (right)","Continuous","MLM",9859,NA,"","https://ukb-wes.oss-us-west-1.aliyuncs.com/25126.v1.1.fastGWA.gz"
"25251","Mean L2 in body of corpus callosum on FA skeleton","Continuous","MLM",9859,NA,"","https://ukb-wes.oss-us-west-1.aliyuncs.com/25251.v1.1.fastGWA.gz"
"25301","Mean L3 in fornix on FA skeleton","Continuous","MLM",9859,NA,"","https://ukb-wes.oss-us-west-1.aliyuncs.com/25301.v1.1.fastGWA.gz"
"25074","Mean FA in posterior limb of internal capsule on FA skeleton (right)","Continuous","MLM",9859,NA,"","https://ukb-wes.oss-us-west-1.aliyuncs.com/25074.v1.1.fastGWA.gz"
"25192","Mean MO in superior longitudinal fasciculus on FA skeleton (right)","Continuous","MLM",9859,NA,"","https://ukb-wes.oss-us-west-1.aliyuncs.com/25192.v1.1.fastGWA.gz"
"25295","Mean L2 in tapetum on FA skeleton (left)","Continuous","MLM",9859,NA,"","https://ukb-wes.oss-us-west-1.aliyuncs.com/25295.v1.1.fastGWA.gz"
"25320","Mean L3 in superior corona radiata on FA skeleton (right)","Continuous","MLM",9859,NA,"","https://ukb-wes.oss-us-west-1.aliyuncs.com/25320.v1.1.fastGWA.gz"
"25128","Mean MD in superior corona radiata on FA skeleton (right)","Continuous","MLM",9859,NA,"","https://ukb-wes.oss-us-west-1.aliyuncs.com/25128.v1.1.fastGWA.gz"
"25109","Mean MD in fornix on FA skeleton","Continuous","MLM",9859,NA,"","https://ukb-wes.oss-us-west-1.aliyuncs.com/25109.v1.1.fastGWA.gz"
"25319","Mean L3 in anterior corona radiata on FA skeleton (left)","Continuous","MLM",9859,NA,"","https://ukb-wes.oss-us-west-1.aliyuncs.com/25319.v1.1.fastGWA.gz"
"25215","Mean L1 in cerebral peduncle on FA skeleton (left)","Continuous","MLM",9859,NA,"","https://ukb-wes.oss-us-west-1.aliyuncs.com/25215.v1.1.fastGWA.gz"
"25314","Mean L3 in posterior limb of internal capsule on FA skeleton (right)","Continuous","MLM",9859,NA,"","https://ukb-wes.oss-us-west-1.aliyuncs.com/25314.v1.1.fastGWA.gz"
"25240","Mean L1 in superior longitudinal fasciculus on FA skeleton (right)","Continuous","MLM",9859,NA,"","https://ukb-wes.oss-us-west-1.aliyuncs.com/25240.v1.1.fastGWA.gz"
"25231","Mean L1 in sagittal stratum on FA skeleton (left)","Continuous","MLM",9859,NA,"","https://ukb-wes.oss-us-west-1.aliyuncs.com/25231.v1.1.fastGWA.gz"
"25146","Mean MD in superior fronto-occipital fasciculus on FA skeleton (right)","Continuous","MLM",9859,NA,"","https://ukb-wes.oss-us-west-1.aliyuncs.com/25146.v1.1.fastGWA.gz"
"25262","Mean L2 in cerebral peduncle on FA skeleton (right)","Continuous","MLM",9859,NA,"","https://ukb-wes.oss-us-west-1.aliyuncs.com/25262.v1.1.fastGWA.gz"
"25059","Mean FA in body of corpus callosum on FA skeleton","Continuous","MLM",9859,NA,"","https://ukb-wes.oss-us-west-1.aliyuncs.com/25059.v1.1.fastGWA.gz"
"25248","Mean L2 in middle cerebellar peduncle on FA skeleton","Continuous","MLM",9859,NA,"","https://ukb-wes.oss-us-west-1.aliyuncs.com/25248.v1.1.fastGWA.gz"
"25184","Mean MO in external capsule on FA skeleton (right)","Continuous","MLM",9859,NA,"","https://ukb-wes.oss-us-west-1.aliyuncs.com/25184.v1.1.fastGWA.gz"
"25308","Mean L3 in superior cerebellar peduncle on FA skeleton (right)","Continuous","MLM",9859,NA,"","https://ukb-wes.oss-us-west-1.aliyuncs.com/25308.v1.1.fastGWA.gz"
"25091","Mean FA in cingulum cingulate gyrus on FA skeleton (left)","Continuous","MLM",9859,NA,"","https://ukb-wes.oss-us-west-1.aliyuncs.com/25091.v1.1.fastGWA.gz"
"25315","Mean L3 in posterior limb of internal capsule on FA skeleton (left)","Continuous","MLM",9859,NA,"","https://ukb-wes.oss-us-west-1.aliyuncs.com/25315.v1.1.fastGWA.gz"
"25179","Mean MO in posterior corona radiata on FA skeleton (left)","Continuous","MLM",9859,NA,"","https://ukb-wes.oss-us-west-1.aliyuncs.com/25179.v1.1.fastGWA.gz"
"25330","Mean L3 in cingulum cingulate gyrus on FA skeleton (right)","Continuous","MLM",9859,NA,"","https://ukb-wes.oss-us-west-1.aliyuncs.com/25330.v1.1.fastGWA.gz"
"25227","Mean L1 in posterior corona radiata on FA skeleton (left)","Continuous","MLM",9859,NA,"","https://ukb-wes.oss-us-west-1.aliyuncs.com/25227.v1.1.fastGWA.gz"
"25123","Mean MD in posterior limb of internal capsule on FA skeleton (left)","Continuous","MLM",9859,NA,"","https://ukb-wes.oss-us-west-1.aliyuncs.com/25123.v1.1.fastGWA.gz"
"25247","Mean L1 in tapetum on FA skeleton (left)","Continuous","MLM",9859,NA,"","https://ukb-wes.oss-us-west-1.aliyuncs.com/25247.v1.1.fastGWA.gz"
"25312","Mean L3 in anterior limb of internal capsule on FA skeleton (right)","Continuous","MLM",9859,NA,"","https://ukb-wes.oss-us-west-1.aliyuncs.com/25312.v1.1.fastGWA.gz"
